www.freak.in/cartoon/01.png, NaMo is back, Politics, 2, 2
www.freak.in/cartoon/02.png, Chandrayan-2, News, 2, 3
www.freak.in/cartoon/03.png, Kagaz Nahi Dikhayenge, Politics, 2, 4
www.freak.in/cartoon/04.png, "Happy" New Year, Humour, 3, 1
www.freak.in/cartoon/05.png, China Strikes Again, Corona, 3, 2
www.freak.in/cartoon/06.png, Indefinite Homecoming, Corona, 3, 3
www.freak.in/cartoon/07.png, Online Education, Corona, 3, 3
www.freak.in/cartoon/08.png, WhiteHat Jr, Current Affairs, 3, 4
www.freak.in/cartoon/09.png, PUBG Ban, News, 3, 4